{
  "schema": "personal-agent-os/ai-improvement-technique-catalog/v1",
  "as_of": "2026-09-24",
  "domain": "data_training_model_inference",
  "techniques": [
    {
      "id": "AIT-0121",
      "name": "Training-data exact/near deduplication",
      "aliases": [],
      "category": "data_quality",
      "layer": [
        "data",
        "training"
      ],
      "goal": "Reduce memorization, train-test leakage and wasted training compute",
      "mechanism": "Remove exact/near duplicate sequences/documents and explicitly decontaminate evaluation sets.",
      "maturity": "replicated_research",
      "evidence": {
        "strength": "high",
        "summary": "Evidence basis: SRC-AI-0116.",
        "limitations": []
      },
      "agent_os_fit": "conditional",
      "agent_os_pattern": "General principle also applies to Agent OS knowledge/context candidate stores.",
      "use_when": [
        "Any local model training/fine-tuning corpus",
        "Synthetic data generation"
      ],
      "avoid_when": [
        "Tiny intentionally repeated curriculum where repetition is controlled"
      ],
      "required_evals": [
        "memorization",
        "held-out accuracy",
        "steps-to-target",
        "contamination"
      ],
      "risks": [
        "Over-aggressive dedupe removes legitimate repeated forms"
      ],
      "cost_profile": "preprocessing saves training compute",
      "complexity": "medium",
      "dependencies": [],
      "sources": [
        "SRC-AI-0116"
      ],
      "keywords": [
        "dedupe",
        "decontamination"
      ],
      "notes": ""
    },
    {
      "id": "AIT-0122",
      "name": "Data quality filtering",
      "aliases": [],
      "category": "data_quality",
      "layer": [
        "data",
        "training"
      ],
      "goal": "Train on fewer, higher-value examples",
      "mechanism": "Score/filter incorrect, irrelevant, malformed, low-information or low-quality examples before training.",
      "maturity": "replicated_research",
      "evidence": {
        "strength": "high",
        "summary": "Evidence basis: SRC-AI-0112, SRC-AI-0113.",
        "limitations": []
      },
      "agent_os_fit": "conditional",
      "agent_os_pattern": "Preserve rejected sample metadata/reasons for audit.",
      "use_when": [
        "Fine-tuning/local model corpus"
      ],
      "avoid_when": [
        "Filter score is unvalidated or systematically biased"
      ],
      "required_evals": [
        "full vs filtered training",
        "subgroup coverage"
      ],
      "risks": [
        "Judge/filter bias",
        "loss of diversity/tail cases"
      ],
      "cost_profile": "filter cost; lower training cost",
      "complexity": "medium",
      "dependencies": [],
      "sources": [
        "SRC-AI-0112",
        "SRC-AI-0113"
      ],
      "keywords": [
        "data_quality",
        "filtering"
      ],
      "notes": ""
    },
    {
      "id": "AIT-0123",
      "name": "Targeted influence-based data selection",
      "aliases": [],
      "category": "data_selection",
      "layer": [
        "data",
        "training"
      ],
      "goal": "Train a capability with only examples most influential for it",
      "mechanism": "Use target examples and gradient/influence similarity to select a small relevant subset.",
      "maturity": "promising_research",
      "evidence": {
        "strength": "medium_high",
        "summary": "Evidence basis: SRC-AI-0114.",
        "limitations": []
      },
      "agent_os_fit": "research_only",
      "agent_os_pattern": "Useful research lead if Agent OS later trains domain adapters.",
      "use_when": [
        "Future specialized local model/adapter"
      ],
      "avoid_when": [
        "No model-weight access",
        "General-purpose broad alignment"
      ],
      "required_evals": [
        "target task success",
        "transfer",
        "selection cost"
      ],
      "risks": [
        "Target overfit",
        "selection complexity"
      ],
      "cost_profile": "high preprocessing, lower training",
      "complexity": "very_high",
      "dependencies": [],
      "sources": [
        "SRC-AI-0114"
      ],
      "keywords": [
        "LESS",
        "influence"
      ],
      "notes": ""
    },
    {
      "id": "AIT-0124",
      "name": "Domain mixture optimization",
      "aliases": [],
      "category": "data_selection",
      "layer": [
        "data",
        "pretraining"
      ],
      "goal": "Allocate training tokens across source domains more effectively",
      "mechanism": "Train proxy/reference models and optimize domain weights based on excess loss/minimax objective.",
      "maturity": "promising_research",
      "evidence": {
        "strength": "medium_high",
        "summary": "Evidence basis: SRC-AI-0115.",
        "limitations": []
      },
      "agent_os_fit": "research_only",
      "agent_os_pattern": "Low near-term Agent OS priority.",
      "use_when": [
        "Pretraining a local foundational/domain model"
      ],
      "avoid_when": [
        "Ordinary hosted-model Agent OS"
      ],
      "required_evals": [
        "downstream performance per FLOP"
      ],
      "risks": [
        "Proxy-to-large transfer failure",
        "domain definition choices"
      ],
      "cost_profile": "very high",
      "complexity": "very_high",
      "dependencies": [],
      "sources": [
        "SRC-AI-0115"
      ],
      "keywords": [
        "DoReMi",
        "data_mixture"
      ],
      "notes": ""
    },
    {
      "id": "AIT-0125",
      "name": "Small curated instruction-tuning set",
      "aliases": [],
      "category": "instruction_tuning",
      "layer": [
        "training",
        "data"
      ],
      "goal": "Teach behavior efficiently when base model already has knowledge",
      "mechanism": "Fine-tune on small diverse high-quality demonstrations rather than maximizing example count.",
      "maturity": "replicated_research",
      "evidence": {
        "strength": "medium_high",
        "summary": "Evidence basis: SRC-AI-0112, SRC-AI-0113.",
        "limitations": []
      },
      "agent_os_fit": "conditional",
      "agent_os_pattern": "Prefer skills/prompts first unless repeated workload justifies training.",
      "use_when": [
        "Specialized local assistant adapter"
      ],
      "avoid_when": [
        "Base model lacks underlying capability/knowledge"
      ],
      "required_evals": [
        "generalization",
        "catastrophic forgetting",
        "data ablation"
      ],
      "risks": [
        "Curated set may miss tails",
        "judge bias"
      ],
      "cost_profile": "moderate",
      "complexity": "high",
      "dependencies": [],
      "sources": [
        "SRC-AI-0112",
        "SRC-AI-0113"
      ],
      "keywords": [
        "LIMA",
        "instruction_tuning"
      ],
      "notes": ""
    },
    {
      "id": "AIT-0126",
      "name": "Self-Instruct synthetic instruction generation",
      "aliases": [],
      "category": "synthetic_data",
      "layer": [
        "data",
        "training"
      ],
      "goal": "Expand instruction diversity cheaply",
      "mechanism": "Model generates instruction/input/output triples, filters invalid/similar examples, then trains on accepted synthetic set.",
      "maturity": "replicated_research",
      "evidence": {
        "strength": "medium_high",
        "summary": "Evidence basis: SRC-AI-0117.",
        "limitations": []
      },
      "agent_os_fit": "research_only",
      "agent_os_pattern": "Synthetic examples need provenance, dedupe, filter and real-data anchoring.",
      "use_when": [
        "Local fine-tuning where human labels scarce"
      ],
      "avoid_when": [
        "Synthetic generator shares severe blind spots",
        "High-stakes behavior without human validation"
      ],
      "required_evals": [
        "novel-task eval",
        "diversity",
        "error propagation"
      ],
      "risks": [
        "Self-generated errors",
        "model collapse if recursive/unfiltered"
      ],
      "cost_profile": "generation + training",
      "complexity": "high",
      "dependencies": [],
      "sources": [
        "SRC-AI-0117"
      ],
      "keywords": [
        "Self_Instruct",
        "synthetic"
      ],
      "notes": ""
    },
    {
      "id": "AIT-0127",
      "name": "Synthetic textbook/curriculum data",
      "aliases": [],
      "category": "synthetic_data",
      "layer": [
        "data",
        "training"
      ],
      "goal": "Increase information density and pedagogical structure",
      "mechanism": "Generate high-quality textbook-like explanations/exercises covering target concepts, then filter and train.",
      "maturity": "promising_research",
      "evidence": {
        "strength": "medium_high",
        "summary": "Evidence basis: SRC-AI-0118.",
        "limitations": []
      },
      "agent_os_fit": "research_only",
      "agent_os_pattern": "Potential for offline specialized utilities, not personal facts.",
      "use_when": [
        "Narrow local model skill domains"
      ],
      "avoid_when": [
        "Generator accuracy cannot be verified"
      ],
      "required_evals": [
        "held-out target tasks",
        "factual audits"
      ],
      "risks": [
        "Synthetic factual errors",
        "coverage bias"
      ],
      "cost_profile": "high generation/training",
      "complexity": "high",
      "dependencies": [],
      "sources": [
        "SRC-AI-0118"
      ],
      "keywords": [
        "textbook_data",
        "phi"
      ],
      "notes": ""
    },
    {
      "id": "AIT-0128",
      "name": "Real-data anchoring for synthetic corpora",
      "aliases": [],
      "category": "synthetic_data",
      "layer": [
        "data",
        "training"
      ],
      "goal": "Reduce recursive synthetic-data collapse",